{
  "$schema": "http://json-schema.org/draft-07/schema#",
  "$id": "https://github.com/jmagar/dendrite/plugins/schemas/codex-plugin.schema.json",
  "title": "Codex Plugin Manifest",
  "description": "Docs-derived schema for .codex-plugin/plugin.json. Based on OpenAI Codex plugin docs and the current Codex manifest parser; Codex does not currently publish a standalone JSON Schema.",
  "type": "object",
  "additionalProperties": true,
  "required": ["name"],
  "properties": {
    "$schema": {
      "type": "string"
    },
    "name": {
      "type": "string",
      "minLength": 1,
      "pattern": "^[A-Za-z0-9][A-Za-z0-9._-]*$"
    },
    "version": {
      "type": "string"
    },
    "description": {
      "type": "string"
    },
    "author": {
      "oneOf": [
        {
          "type": "string"
        },
        {
          "type": "object",
          "additionalProperties": true,
          "properties": {
            "name": {
              "type": "string"
            },
            "email": {
              "type": "string"
            },
            "url": {
              "type": "string"
            }
          }
        }
      ]
    },
    "homepage": {
      "type": "string"
    },
    "repository": {
      "type": "string"
    },
    "license": {
      "type": "string"
    },
    "keywords": {
      "type": "array",
      "items": {
        "type": "string"
      }
    },
    "skills": {
      "$ref": "#/definitions/pathOrPathList"
    },
    "commands": {
      "$ref": "#/definitions/pathOrPathList"
    },
    "hooks": {
      "oneOf": [
        {
          "$ref": "#/definitions/pathOrPathList"
        },
        {
          "type": "object"
        },
        {
          "type": "array",
          "items": {
            "type": "object"
          }
        }
      ]
    },
    "mcpServers": {
      "oneOf": [
        {
          "type": "string",
          "pattern": "^\\./"
        },
        {
          "type": "object",
          "additionalProperties": {
            "type": "object"
          }
        }
      ]
    },
    "apps": {
      "type": "string",
      "pattern": "^\\./"
    },
    "interface": {
      "type": "object",
      "additionalProperties": true,
      "properties": {
        "displayName": {
          "type": "string"
        },
        "shortDescription": {
          "type": "string"
        },
        "longDescription": {
          "type": "string"
        },
        "developerName": {
          "type": "string"
        },
        "category": {
          "type": "string"
        },
        "capabilities": {
          "type": "array",
          "items": {
            "type": "string"
          }
        },
        "websiteURL": {
          "type": "string"
        },
        "privacyPolicyURL": {
          "type": "string"
        },
        "termsOfServiceURL": {
          "type": "string"
        },
        "defaultPrompt": {
          "oneOf": [
            {
              "type": "string",
              "minLength": 1,
              "maxLength": 128
            },
            {
              "type": "array",
              "maxItems": 3,
              "items": {
                "type": "string",
                "minLength": 1,
                "maxLength": 128
              }
            }
          ]
        },
        "brandColor": {
          "type": "string"
        },
        "composerIcon": {
          "type": "string",
          "pattern": "^\\./"
        },
        "logo": {
          "type": "string",
          "pattern": "^\\./"
        },
        "screenshots": {
          "type": "array",
          "items": {
            "type": "string",
            "pattern": "^\\./"
          }
        }
      }
    }
  },
  "definitions": {
    "pathOrPathList": {
      "oneOf": [
        {
          "type": "string",
          "pattern": "^\\./"
        },
        {
          "type": "array",
          "items": {
            "type": "string",
            "pattern": "^\\./"
          }
        }
      ]
    }
  }
}
