{
  "$schema": "https://json.schemastore.org/claude-code-plugin-manifest.json",
  "name": "testing",
  "description": "App-testing and MCP-tooling skills: live QA of web, Android, and desktop apps; MCP server smoke-testing (mcporter); MCP-UI / Apps validation (mcpjam); and claude-in-mobile device automation.",
  "skills": "./skills/",
  "author": {
    "name": "Jacob Magar",
    "email": "jmagar@users.noreply.github.com"
  },
  "repository": "https://github.com/jmagar/lab",
  "homepage": "https://github.com/jmagar/lab",
  "license": "MIT",
  "keywords": [
    "testing",
    "qa",
    "e2e",
    "android",
    "desktop",
    "web",
    "mcp",
    "mcporter",
    "mcpjam",
    "homelab"
  ]
}
