{
  "$schema": "https://json.schemastore.org/claude-code-plugin-manifest.json",
  "name": "notebooklm",
  "description": "NotebookLM research, source, generation, and download workflows.",
  "skills": "./skills/",
  "author": {
    "name": "Jacob Magar",
    "email": "jmagar@users.noreply.github.com"
  },
  "repository": "https://github.com/jmagar/claude-homelab",
  "homepage": "https://github.com/jmagar/claude-homelab",
  "license": "MIT",
  "keywords": [
    "notebooklm",
    "research",
    "sources",
    "generation"
  ]
}
