{
  "name": "uptime-kuma",
  "description": "Read-only monitoring of a self-hosted Uptime Kuma instance via direct HTTP — Prometheus /metrics (API-key auth) and public status-page JSON. No monitor management (that requires Uptime Kuma's socket.io API).",
  "author": {
    "name": "Jacob Magar",
    "email": "jmagar@users.noreply.github.com"
  },
  "repository": "https://github.com/jmagar/lab",
  "homepage": "https://github.com/jmagar/lab",
  "license": "MIT",
  "keywords": [
    "uptime-kuma",
    "monitoring",
    "uptime",
    "status-page",
    "homelab"
  ],
  "skills": "./skills/",
  "hooks": "./hooks/hooks.json",
  "interface": {
    "displayName": "Uptime Kuma",
    "shortDescription": "Read Uptime Kuma monitor, metrics, and public status-page state.",
    "longDescription": "Uptime Kuma provides read-only monitoring workflows for Prometheus metrics, API-key checks, public status-page JSON, heartbeat history, and uptime summaries.",
    "developerName": "Jacob Magar",
    "category": "Operations",
    "capabilities": [
      "Read"
    ],
    "defaultPrompt": [
      "Use Uptime Kuma to check monitor status.",
      "Summarize the public status page.",
      "Find monitors with recent downtime."
    ],
    "brandColor": "#5CDD8B"
  }
}
