{
  "name": "navidrome",
  "description": "Operate a self-hosted Navidrome music server through its Subsonic API with direct HTTP calls — ping, browse artists/albums, search, and list playlists.",
  "author": {
    "name": "Jacob Magar",
    "email": "jmagar@users.noreply.github.com"
  },
  "repository": "https://github.com/jmagar/lab",
  "homepage": "https://github.com/jmagar/lab",
  "license": "MIT",
  "keywords": [
    "navidrome",
    "subsonic",
    "music",
    "streaming",
    "homelab"
  ],
  "skills": "./skills/",
  "hooks": "./hooks/hooks.json",
  "interface": {
    "displayName": "Navidrome",
    "shortDescription": "Browse and inspect a Navidrome music library through the Subsonic API.",
    "longDescription": "Navidrome provides read-only music-library workflows for pinging the server, browsing artists and albums, searching tracks, listing playlists, and checking now-playing state.",
    "developerName": "Jacob Magar",
    "category": "Media",
    "capabilities": [
      "Read"
    ],
    "defaultPrompt": [
      "Use Navidrome to search my music library.",
      "List Navidrome playlists.",
      "Check whether Navidrome is reachable."
    ],
    "brandColor": "#06B6D4"
  }
}
