{
  "name": "notebooklm",
  "description": "NotebookLM research, source, generation, and download workflows.",
  "author": {
    "name": "Jacob Magar",
    "email": "jmagar@users.noreply.github.com"
  },
  "repository": "https://github.com/jmagar/lab",
  "homepage": "https://github.com/jmagar/lab",
  "license": "MIT",
  "keywords": [
    "notebooklm",
    "research",
    "sources",
    "generation"
  ],
  "skills": "./skills/",
  "interface": {
    "displayName": "NotebookLM",
    "shortDescription": "Operate NotebookLM sources, notebooks, and generated research artifacts.",
    "longDescription": "NotebookLM provides programmatic workflows for managing sources, querying notebooks, generating summaries, and downloading research outputs.",
    "developerName": "Jacob Magar",
    "category": "Research",
    "capabilities": [
      "Read",
      "Write"
    ],
    "defaultPrompt": [
      "Use NotebookLM to summarize this notebook.",
      "Add this source to NotebookLM.",
      "List recent NotebookLM generated outputs."
    ],
    "brandColor": "#4285F4"
  }
}
