{
  "$schema": "https://json.schemastore.org/claude-code-plugin-manifest.json",
  "name": "loggifly",
  "description": "Skill for operating loggifly via the lab MCP server / CLI.",
  "skills": "./skills/",
  "author": {
    "name": "Jacob Magar",
    "email": "jmagar@users.noreply.github.com"
  },
  "repository": "https://github.com/jmagar/lab",
  "homepage": "https://github.com/jmagar/lab",
  "license": "MIT",
  "keywords": [
    "loggifly",
    "docker",
    "logs",
    "alerts",
    "homelab"
  ]
}
