{
  "name": "upstream-skills",
  "description": "Skills vendored verbatim from upstream repos (openclaw + openai), kept in sync via sync-upstream-skills.",
  "author": {
    "name": "Jacob Magar",
    "email": "jmagar@users.noreply.github.com"
  },
  "repository": "https://github.com/jmagar/dendrite",
  "homepage": "https://github.com/jmagar/dendrite",
  "license": "MIT",
  "keywords": ["skills", "vendored", "upstream", "sync"],
  "skills": "./skills/",
  "interface": {
    "displayName": "Upstream Skills",
    "shortDescription": "Skills vendored from upstream repos, kept in sync.",
    "longDescription": "A bundle of agent skills vendored verbatim from their upstream repositories (openclaw and openai orgs). Each skill folder is mirrored whole; the sync-upstream-skills tool detects and applies upstream drift via per-skill content hashes.",
    "developerName": "Jacob Magar",
    "category": "Developer Tools",
    "capabilities": ["Read", "Write", "Automation"],
    "defaultPrompt": [
      "Use the meme-maker skill to caption an image.",
      "Use the handoff skill to summarize this session."
    ],
    "brandColor": "#29B6F6"
  }
}
