{
  "name": "immich",
  "description": "Skill for operating immich via the lab MCP server / CLI.",
  "author": {
    "name": "Jacob Magar",
    "email": "jmagar@users.noreply.github.com"
  },
  "repository": "https://github.com/jmagar/lab",
  "homepage": "https://github.com/jmagar/lab",
  "license": "MIT",
  "keywords": [
    "immich",
    "photos",
    "media",
    "backup",
    "homelab"
  ],
  "skills": "./skills/",
  "hooks": "./hooks/hooks.json",
  "interface": {
    "displayName": "Immich",
    "shortDescription": "Operate Immich photo and video management workflows.",
    "longDescription": "Immich packages workflows for searching assets, reviewing albums and jobs, checking server state, and assisting with self-hosted photo library operations.",
    "developerName": "Jacob Magar",
    "category": "Media",
    "capabilities": [
      "Read",
      "Write"
    ],
    "defaultPrompt": [
      "Use Immich to inspect recent upload status.",
      "Search Immich for assets from a date range.",
      "Check Immich server health."
    ],
    "brandColor": "#6366F1"
  }
}
