{
  "name": "qdrant",
  "description": "Vector database collections and semantic search via direct calls to the Qdrant REST API.",
  "author": {
    "name": "Jacob Magar",
    "email": "jmagar@users.noreply.github.com"
  },
  "repository": "https://github.com/jmagar/lab",
  "homepage": "https://github.com/jmagar/lab",
  "license": "MIT",
  "keywords": [
    "qdrant",
    "vectors",
    "embeddings",
    "search",
    "ai",
    "homelab"
  ],
  "skills": "./skills/",
  "hooks": "./hooks/hooks.json",
  "interface": {
    "displayName": "Qdrant",
    "shortDescription": "Inspect and manage Qdrant vector collections.",
    "longDescription": "Qdrant provides workflows for collections, points, payloads, search, vector database health, and semantic-search troubleshooting.",
    "developerName": "Jacob Magar",
    "category": "Data Analytics",
    "capabilities": [
      "Read",
      "Write"
    ],
    "defaultPrompt": [
      "Use Qdrant to list collections.",
      "Inspect this Qdrant collection configuration.",
      "Search Qdrant for similar vectors."
    ],
    "brandColor": "#DC244C"
  }
}
