{
  "name": "agent-os",
  "description": "Drive the agent-os Windows 11 sandbox VM through the Labby gateway or an already-configured Windows-MCP endpoint. Ships the agent-os skill, a /agent-os status command, and a SessionStart health check.",
  "author": {
    "name": "Jacob Magar",
    "email": "jmagar@users.noreply.github.com"
  },
  "repository": "https://github.com/jmagar/lab",
  "homepage": "https://github.com/jmagar/lab",
  "license": "MIT",
  "keywords": [
    "agent-os",
    "windows",
    "windows-mcp",
    "sandbox",
    "vm",
    "automation",
    "homelab"
  ],
  "skills": "./skills/",
  "commands": "./commands/",
  "hooks": "./hooks/hooks.json",
  "interface": {
    "displayName": "Agent OS",
    "shortDescription": "Drive the dedicated Windows 11 agent VM through Windows-MCP.",
    "longDescription": "Agent OS connects Codex to the dedicated Windows 11 sandbox VM for desktop automation, Windows app testing, screenshots, shell commands, and VM health checks.",
    "developerName": "Jacob Magar",
    "category": "Developer Tools",
    "capabilities": [
      "Interactive",
      "Read",
      "Write"
    ],
    "defaultPrompt": [
      "Use Agent OS to inspect the Windows VM.",
      "Run a PowerShell command on agent-os.",
      "Take a screenshot of the agent-os desktop."
    ],
    "brandColor": "#60A5FA"
  }
}
