{
  "name": "zsnoop-mcp",
  "version": "0.1.0",
  "description": "ZFS snapshot exploration and recovery over SSH through the zsnoop-mcp server.",
  "author": {
    "name": "Jacob Magar",
    "email": "jmagar@users.noreply.github.com"
  },
  "repository": "https://github.com/hamsolodev/zsnoop-mcp",
  "homepage": "https://hamsolodev.github.io/zsnoop-mcp/",
  "license": "MIT",
  "keywords": [
    "zfs",
    "snapshots",
    "recovery",
    "ssh",
    "mcp"
  ],
  "skills": "./skills/",
  "interface": {
    "displayName": "Zsnoop MCP",
    "shortDescription": "Explore ZFS snapshots and recover files through zsnoop-mcp.",
    "longDescription": "Zsnoop MCP packages operating guidance for ZFS snapshot discovery, diffing, file reads, fetches, and opt-in restore workflows over SSH or local transport through an already-configured zsnoop-mcp server.",
    "developerName": "Mark Hellewell / Jacob Magar",
    "category": "Operations",
    "capabilities": [
      "Read",
      "Write"
    ],
    "defaultPrompt": [
      "Use Zsnoop MCP to list configured ZFS hosts.",
      "Find when this file disappeared from ZFS snapshots.",
      "Recover a file from a ZFS snapshot with zsnoop-mcp."
    ],
    "brandColor": "#2563EB"
  }
}
