{
  "name": "neo4j",
  "description": "Operate a Neo4j graph database with Cypher over the HTTP transactional API or cypher-shell.",
  "author": {
    "name": "Jacob Magar",
    "email": "jmagar@users.noreply.github.com"
  },
  "repository": "https://github.com/jmagar/lab",
  "homepage": "https://github.com/jmagar/lab",
  "license": "MIT",
  "keywords": [
    "neo4j",
    "graph",
    "database",
    "cypher",
    "homelab"
  ],
  "skills": "./skills/",
  "hooks": "./hooks/hooks.json",
  "interface": {
    "displayName": "Neo4j",
    "shortDescription": "Run Neo4j graph queries and inspect graph schema.",
    "longDescription": "Neo4j bundles Cypher query, schema inspection, node and relationship exploration, and graph-database troubleshooting workflows.",
    "developerName": "Jacob Magar",
    "category": "Data Analytics",
    "capabilities": [
      "Read",
      "Write"
    ],
    "defaultPrompt": [
      "Use Neo4j to inspect the graph schema.",
      "Run a Cypher query for related nodes.",
      "Explain this Neo4j query plan."
    ],
    "brandColor": "#008CC1"
  }
}
