{
  "$schema": "https://json.schemastore.org/claude-code-plugin-manifest.json",
  "name": "dozzle",
  "description": "Skill for operating Dozzle through direct HTTP API checks, auth guidance, and MCP setup notes.",
  "author": {
    "name": "Jacob Magar",
    "email": "jmagar@users.noreply.github.com"
  },
  "repository": "https://github.com/jmagar/lab",
  "homepage": "https://github.com/jmagar/lab",
  "license": "MIT",
  "keywords": [
    "dozzle",
    "docker",
    "logs",
    "containers",
    "homelab"
  ]
}
