{
  "$schema": "https://json.schemastore.org/claude-code-plugin-manifest.json",
  "name": "acp",
  "description": "Agent Client Protocol skills for Rust, Python, and TypeScript implementations.",
  "skills": "./skills/",
  "author": {
    "name": "Jacob Magar",
    "email": "jmagar@users.noreply.github.com"
  },
  "repository": "https://github.com/jmagar/claude-homelab",
  "homepage": "https://github.com/jmagar/claude-homelab",
  "license": "MIT",
  "keywords": [
    "acp",
    "agents",
    "protocol",
    "rust",
    "python",
    "typescript"
  ]
}
