{
  "name": "acp",
  "description": "Rust implementation patterns for ACP, rmcp-derived MCP servers, and Lab runtime work.",
  "author": {
    "name": "Jacob Magar",
    "email": "jmagar@users.noreply.github.com"
  },
  "repository": "https://github.com/jmagar/lab",
  "homepage": "https://github.com/jmagar/lab",
  "license": "MIT",
  "keywords": [
    "acp",
    "agents",
    "protocol",
    "rust",
    "rmcp",
    "lab"
  ],
  "skills": "./skills/",
  "interface": {
    "displayName": "ACP",
    "shortDescription": "Rust implementation guidance for ACP, rmcp MCP servers, and Lab runtime work.",
    "longDescription": "ACP packages implementation skills and protocol references for building Agent Client Protocol clients and agents, including session lifecycle, streaming, tool calls, and adapter patterns.",
    "developerName": "Jacob Magar",
    "category": "Developer Tools",
    "capabilities": [
      "Read"
    ],
    "defaultPrompt": [
      "Use ACP to design a Rust agent-client-protocol integration.",
      "Review this ACP session lifecycle implementation.",
      "Explain how ACP tool calls should stream results."
    ],
    "brandColor": "#7C3AED"
  }
}
